19:49:54.747113 IP 192.168.1.101.51701 > 192.168.1.1.domain: 55949+ A? reader.google.com. (35)
19:49:55.212123 IP 192.168.1.1.domain > 192.168.1.101.51701: 55949 6/0/0 CNAME www2.l.google.com., A 173.194.41.81, A 173.194.41.84, A 173.194.41.83, A 173.194.41.82, A 173.194.41.80 (136)
19:49:55.385837 IP 192.168.1.101.56157 > 192.168.1.1.domain: 22209+ PTR? 1.1.168.192.in-addr.arpa. (42)
19:49:55.626256 IP 192.168.1.1.domain > 192.168.1.101.56157: 22209 NXDomain 0/1/0 (91)
19:49:55.627486 IP 192.168.1.101.58896 > 192.168.1.1.domain: 8138+ PTR? 101.1.168.192.in-addr.arpa. (44)
19:49:56.032243 IP 192.168.1.1.domain > 192.168.1.101.58896: 8138 NXDomain 0/1/0 (93)
19:49:56.034808 IP 192.168.1.101.61776 > 192.168.1.1.domain: 61951+ A? www.l.google.com. (34)
19:49:56.141695 IP 192.168.1.1.domain > 192.168.1.101.61776: 61951 6/0/0 A 74.125.132.105, A 74.125.132.104, A 74.125.132.147, A 74.125.132.99, A 74.125.132.106, A 74.125.132.103 (130)
19:49:58.725030 IP 192.168.1.101.63369 > 192.168.1.1.domain: 20318+ A? ssl-google-analytics.l.google.com. (51)
19:49:59.102747 IP 192.168.1.1.domain > 192.168.1.101.63369: 20318 1/0/0 A 173.194.41.190 (67)
19:50:10.993142 IP 192.168.1.101.59620 > 192.168.1.1.domain: 29444+ A? accounts.google.co.uk. (39)
19:50:11.022049 IP 192.168.1.1.domain > 192.168.1.101.59620: 29444 2/0/0 CNAME accounts-cctld.l.google.com., A 74.125.132.94 (96)
19:50:11.581604 IP 192.168.1.101.51675 > 192.168.1.1.domain: 25009+ A? www.l.google.com. (34)
19:50:11.609494 IP 192.168.1.1.domain > 192.168.1.101.51675: 25009 6/0/0 A 173.194.67.104, A 173.194.67.99, A 173.194.67.105, A 173.194.67.147, A 173.194.67.106, A 173.194.67.103 (130)
19:50:13.021173 IP 192.168.1.101.60816 > 192.168.1.1.domain: 41010+ A? plus.google.com. (33)
19:50:13.021427 IP 192.168.1.101.52548 > 192.168.1.1.domain: 33812+ A? www.google.co.uk. (34)
19:50:13.021763 IP 192.168.1.101.55374 > 192.168.1.1.domain: 9688+ A? maps.l.google.com. (35)
19:50:13.044632 IP 192.168.1.101.52392 > 192.168.1.1.domain: 63669+ A? lh6.googleusercontent.com. (43)
19:50:13.113781 IP 192.168.1.1.domain > 192.168.1.101.60816: 41010 11/0/0 A 173.194.34.137, A 173.194.34.142, A 173.194.34.134, A 173.194.34.135, A 173.194.34.133, A 173.194.34.129, A 173.194.34.132, A 173.194.34.130, A 173.194.34.128, A 173.194.34.136, A 173.194.34.131 (209)
19:50:13.125302 IP 192.168.1.1.domain > 192.168.1.101.52548: 33812 2/0/0 CNAME www-cctld.l.google.com., A 74.125.132.94 (86)
19:50:13.127739 IP 192.168.1.1.domain > 192.168.1.101.55374: 9688 11/0/0 A 173.194.41.101, A 173.194.41.110, A 173.194.41.100, A 173.194.41.97, A 173.194.41.96, A 173.194.41.98, A 173.194.41.104, A 173.194.41.105, A 173.194.41.103, A 173.194.41.99, A 173.194.41.102 (211)
19:50:13.131102 IP 192.168.1.1.domain > 192.168.1.101.52392: 63669 4/0/0 CNAME googlehosted.l.googleusercontent.com., A 173.194.34.138, A 173.194.34.140, A 173.194.34.139 (120)
19:50:14.150038 IP 192.168.1.101.57888 > 192.168.1.1.domain: 7835+ A? news.google.co.uk. (35)
19:50:14.150404 IP 192.168.1.101.50733 > 192.168.1.1.domain: 59468+ A? www3.l.google.com. (35)
19:50:14.150851 IP 192.168.1.101.53425 > 192.168.1.1.domain: 55322+ A? youtube-ui.l.google.com. (41)
19:50:14.151423 IP 192.168.1.101.51660 > 192.168.1.1.domain: 47620+ A? drive.google.com. (34)
19:50:14.151687 IP 192.168.1.101.65434 > 192.168.1.1.domain: 27217+ A? googlemail.l.google.com. (41)
19:50:14.306158 IP 192.168.1.1.domain > 192.168.1.101.57888: 7835 4/0/0 CNAME news-cctld.l.google.com., A 173.194.34.152, A 173.194.34.159, A 173.194.34.151 (120)
19:50:14.310874 IP 192.168.1.1.domain > 192.168.1.101.50733: 59468 11/0/0 A 173.194.34.134, A 173.194.34.130, A 173.194.34.128, A 173.194.34.131, A 173.194.34.142, A 173.194.34.133, A 173.194.34.132, A 173.194.34.136, A 173.194.34.137, A 173.194.34.135, A 173.194.34.129 (211)
19:50:14.316765 IP 192.168.1.1.domain > 192.168.1.101.53425: 55322 11/0/0 A 173.194.41.98, A 173.194.41.100, A 173.194.41.110, A 173.194.41.96, A 173.194.41.105, A 173.194.41.101, A 173.194.41.104, A 173.194.41.102, A 173.194.41.97, A 173.194.41.99, A 173.194.41.103 (217)
19:50:14.320600 IP 192.168.1.1.domain > 192.168.1.101.51660: 47620 12/0/0 CNAME writely.l.google.com., A 173.194.41.99, A 173.194.41.110, A 173.194.41.96, A 173.194.41.97, A 173.194.41.105, A 173.194.41.101, A 173.194.41.103, A 173.194.41.98, A 173.194.41.104, A 173.194.41.102, A 173.194.41.100 (234)
19:50:14.322150 IP 192.168.1.1.domain > 192.168.1.101.65434: 27217 2/0/0 A 173.194.34.150, A 173.194.34.149 (73)
19:50:14.374162 IP 192.168.1.101.52635 > 192.168.1.1.domain: 12223+ A? www.blogger.com. (33)
19:50:14.402338 IP 192.168.1.101.57037 > 192.168.1.1.domain: 7896+ A? ssl.gstatic.com. (33)
19:50:14.402610 IP 192.168.1.101.65134 > 192.168.1.1.domain: 59841+ A? s2.googleusercontent.com. (42)
19:50:14.475199 IP 192.168.1.101.59498 > 192.168.1.1.domain: 37209+ A? maps.google.com. (33)
19:50:14.475574 IP 192.168.1.101.50652 > 192.168.1.1.domain: 27272+ A? books.google.co.uk. (36)
19:50:14.475763 IP 192.168.1.101.60219 > 192.168.1.1.domain: 19458+ A? video.google.co.uk. (36)
19:50:14.506925 IP 192.168.1.1.domain > 192.168.1.101.52635: 12223 2/0/0 CNAME blogger.l.google.com., A 74.125.132.191 (80)
19:50:14.561185 IP 192.168.1.1.domain > 192.168.1.101.57037: 7896 1/0/0 A 173.194.41.79 (49)
19:50:14.570235 IP 192.168.1.1.domain > 192.168.1.101.65134: 59841 4/0/0 CNAME googlehosted.l.googleusercontent.com., A 173.194.41.106, A 173.194.41.108, A 173.194.41.107 (119)
19:50:15.478670 IP 192.168.1.101.59498 > 192.168.1.1.domain: 37209+ A? maps.google.com. (33)
19:50:15.478737 IP 192.168.1.101.50652 > 192.168.1.1.domain: 27272+ A? books.google.co.uk. (36)
19:50:15.478747 IP 192.168.1.101.60219 > 192.168.1.1.domain: 19458+ A? video.google.co.uk. (36)
19:50:15.501530 IP 192.168.1.101.60493 > 192.168.1.1.domain: 61000+ A? www.widdershinscomic.com. (42)
19:50:15.501950 IP 192.168.1.101.49418 > 192.168.1.1.domain: 20051+ A? 2.bp.blogspot.com. (35)
19:50:15.514472 IP 192.168.1.1.domain > 192.168.1.101.59498: 37209 12/0/0 CNAME maps.l.google.com., A 173.194.41.103, A 173.194.41.102, A 173.194.41.98, A 173.194.41.96, A 173.194.41.105, A 173.194.41.100, A 173.194.41.110, A 173.194.41.99, A 173.194.41.104, A 173.194.41.101, A 173.194.41.97 (230)
19:50:15.519507 IP 192.168.1.1.domain > 192.168.1.101.50652: 27272 13/0/0 CNAME books.google.com., CNAME www3.l.google.com., A 173.194.41.137, A 173.194.41.133, A 173.194.41.136, A 173.194.41.135, A 173.194.41.132, A 173.194.41.128, A 173.194.41.129, A 173.194.41.134, A 173.194.41.142, A 173.194.41.130, A 173.194.41.131 (263)
19:50:15.520882 IP 192.168.1.1.domain > 192.168.1.101.60219: 19458 13/0/0 CNAME video.google.com., CNAME video.l.google.com., A 173.194.41.98, A 173.194.41.103, A 173.194.41.105, A 173.194.41.110, A 173.194.41.97, A 173.194.41.101, A 173.194.41.100, A 173.194.41.99, A 173.194.41.96, A 173.194.41.104, A 173.194.41.102 (264)
19:50:15.603388 IP 192.168.1.1.domain > 192.168.1.101.49418: 20051 12/0/0 CNAME bloggerphotos.l.google.com., A 173.194.34.142, A 173.194.34.132, A 173.194.34.130, A 173.194.34.133, A 173.194.34.135, A 173.194.34.134, A 173.194.34.131, A 173.194.34.128, A 173.194.34.136, A 173.194.34.137, A 173.194.34.129 (248)
19:50:15.759718 IP 192.168.1.1.domain > 192.168.1.101.60493: 61000 1/0/0 A 173.236.199.248 (58)
19:50:16.519971 IP 192.168.1.101.56745 > 192.168.1.1.domain: 23780+ A? googlereader.blogspot.com. (43)
19:50:16.566604 IP 192.168.1.1.domain > 192.168.1.101.56745: 23780 4/0/0 CNAME blogspot.l.google.com., A 173.194.41.75, A 173.194.41.74, A 173.194.41.76 (123)
19:50:17.423472 IP 192.168.1.101.57228 > 192.168.1.1.domain: 17764+ A? www.kateashwin.com. (36)
19:50:17.605524 IP 192.168.1.1.domain > 192.168.1.101.57228: 17764 1/0/0 A 173.236.167.13 (52)
19:50:17.933016 IP 192.168.1.101.65179 > 192.168.1.1.domain: 65003+ A? apis.google.com. (33)
19:50:17.974671 IP 192.168.1.1.domain > 192.168.1.101.65179: 65003 12/0/0 CNAME plus.l.google.com., A 173.194.34.132, A 173.194.34.128, A 173.194.34.135, A 173.194.34.136, A 173.194.34.134, A 173.194.34.129, A 173.194.34.142, A 173.194.34.131, A 173.194.34.133, A 173.194.34.137, A 173.194.34.130 (230)
19:50:19.106432 IP 192.168.1.101.63384 > 192.168.1.1.domain: 55369+ A? plusone.google.com. (36)
19:50:19.332634 IP 192.168.1.1.domain > 192.168.1.101.63384: 55369 12/0/0 CNAME plus.l.google.com., A 173.194.41.103, A 173.194.41.100, A 173.194.41.105, A 173.194.41.99, A 173.194.41.97, A 173.194.41.101, A 173.194.41.98, A 173.194.41.102, A 173.194.41.110, A 173.194.41.104, A 173.194.41.96 (233)
19:50:21.080039 IP 192.168.1.101.51555 > 192.168.1.1.domain: 27734+ A? humble.pubnub.com. (35)
19:50:21.128667 IP 192.168.1.1.domain > 192.168.1.101.51555: 27734 2/0/0 CNAME pubsub.pubnub.com., A 54.247.190.139 (72)
19:50:27.431921 IP 192.168.1.101.52276 > 192.168.1.1.domain: 38612+ A? thedailywtf.com. (33)
19:50:27.622757 IP 192.168.1.1.domain > 192.168.1.101.52276: 38612 1/0/0 A 74.50.110.120 (49)
19:50:28.188129 IP 192.168.1.101.51316 > 192.168.1.1.domain: 60541+ A? feedads.g.doubleclick.net. (43)
19:50:28.189878 IP 192.168.1.101.59613 > 192.168.1.1.domain: 53034+ A? syndication.thedailywtf.com. (45)
19:50:28.215026 IP 192.168.1.1.domain > 192.168.1.101.51316: 60541 4/0/0 CNAME pagead.l.doubleclick.net., A 173.194.34.153, A 173.194.34.154, A 173.194.34.141 (114)
19:50:28.236310 IP 192.168.1.101.58293 > 192.168.1.1.domain: 23170+ A? img.thedailywtf.com. (37)
19:50:28.237308 IP 192.168.1.101.51884 > 192.168.1.1.domain: 16901+ A? feeds.feedburner.com. (38)
19:50:28.267990 IP 192.168.1.1.domain > 192.168.1.101.51884: 16901 12/0/0 CNAME www4.l.google.com., A 173.194.41.132, A 173.194.41.129, A 173.194.41.137, A 173.194.41.135, A 173.194.41.130, A 173.194.41.136, A 173.194.41.128, A 173.194.41.142, A 173.194.41.134, A 173.194.41.133, A 173.194.41.131 (242)
19:50:28.295811 IP 192.168.1.1.domain > 192.168.1.101.59613: 53034 2/0/0 CNAME ghs.l.google.com., A 74.125.132.121 (88)
19:50:28.343207 IP 192.168.1.1.domain > 192.168.1.101.58293: 23170 1/0/0 A 74.50.110.120 (53)
19:50:53.582737 IP 192.168.1.101.65283 > 192.168.1.1.domain: 44187+ A? www.l.google.com. (34)
19:50:53.613623 IP 192.168.1.1.domain > 192.168.1.101.65283: 44187 6/0/0 A 74.125.132.147, A 74.125.132.104, A 74.125.132.99, A 74.125.132.106, A 74.125.132.105, A 74.125.132.103 (130)
19:50:54.990301 IP 192.168.1.101.64981 > 192.168.1.1.domain: 36711+ A? xkcd.com. (26)
19:50:55.153624 IP 192.168.1.1.domain > 192.168.1.101.64981: 36711 1/0/0 A 107.6.106.82 (42)
19:50:55.450814 IP 192.168.1.101.57451 > 192.168.1.1.domain: 57383+ A? imgs.xkcd.com. (31)
19:50:55.675074 IP 192.168.1.1.domain > 192.168.1.101.57451: 57383 4/0/0 CNAME 2930-xkcdimgs.voxcdn.com., A 208.122.31.13, A 208.122.31.17, A 208.122.31.28 (114)
19:50:56.750465 IP 192.168.1.101.50815 > 192.168.1.1.domain: 8723+ A? forums.xkcd.com. (33)
19:50:56.750700 IP 192.168.1.101.50266 > 192.168.1.1.domain: 49313+ A? blag.xkcd.com. (31)
19:50:56.750850 IP 192.168.1.101.49722 > 192.168.1.1.domain: 53437+ A? store.xkcd.com. (32)
19:50:56.854580 IP 192.168.1.1.domain > 192.168.1.101.50266: 49313 1/0/0 A 208.118.225.100 (47)
19:50:56.945197 IP 192.168.1.1.domain > 192.168.1.101.49722: 53437 1/0/0 A 208.118.225.103 (48)
19:50:56.966887 IP 192.168.1.1.domain > 192.168.1.101.50815: 8723 2/0/0 CNAME www.forums.xkcd.com., A 208.118.225.100 (67)
19:50:57.752452 IP 192.168.1.101.63124 > 192.168.1.1.domain: 50392+ A? dynamic.xkcd.com. (34)
19:50:57.823404 IP 192.168.1.1.domain > 192.168.1.101.63124: 50392 1/0/0 A 208.118.225.100 (50)
19:50:58.256502 IP 192.168.1.101.57270 > 192.168.1.1.domain: 36830+ A? threewordphrase.com. (37)
19:50:58.256689 IP 192.168.1.101.51903 > 192.168.1.1.domain: 1640+ A? oglaf.com. (27)
19:50:58.256910 IP 192.168.1.101.59935 > 192.168.1.1.domain: 43432+ A? www.smbc-comics.com. (37)
19:50:58.257086 IP 192.168.1.101.58357 > 192.168.1.1.domain: 49302+ A? www.qwantz.com. (32)
19:50:58.319964 IP 192.168.1.1.domain > 192.168.1.101.59935: 43432 1/0/0 A 184.107.48.150 (53)
19:50:58.324136 IP 192.168.1.1.domain > 192.168.1.101.58357: 49302 2/0/0 CNAME qwantz.com., A 208.122.50.173 (62)
19:50:58.332700 IP 192.168.1.101.51612 > 192.168.1.1.domain: 6787+ A? clients.l.google.com. (38)
19:50:58.333903 IP 192.168.1.101.51612 > 192.168.1.1.domain: 6787+ A? clients.l.google.com. (38)
19:50:58.425640 IP 192.168.1.1.domain > 192.168.1.101.57270: 36830 1/0/0 A 67.205.47.2 (53)
19:50:58.447042 IP 192.168.1.1.domain > 192.168.1.101.51903: 1640 1/0/0 A 69.163.218.133 (43)
19:50:58.452755 IP 192.168.1.1.domain > 192.168.1.101.51612: 6787 11/0/0 A 173.194.41.135, A 173.194.41.136, A 173.194.41.128, A 173.194.41.137, A 173.194.41.132, A 173.194.41.130, A 173.194.41.129, A 173.194.41.142, A 173.194.41.133, A 173.194.41.134, A 173.194.41.131 (214)
19:50:58.463685 IP 192.168.1.1.domain > 192.168.1.101.51612: 6787 11/0/0 A 173.194.41.66, A 173.194.41.70, A 173.194.41.72, A 173.194.41.71, A 173.194.41.64, A 173.194.41.68, A 173.194.41.78, A 173.194.41.67, A 173.194.41.69, A 173.194.41.73, A 173.194.41.65 (214)
19:50:59.257929 IP 192.168.1.101.61137 > 192.168.1.1.domain: 32932+ A? questionablecontent.net. (41)
19:50:59.258645 IP 192.168.1.101.63998 > 192.168.1.1.domain: 3662+ A? buttersafe.com. (32)
19:50:59.259167 IP 192.168.1.101.53629 > 192.168.1.1.domain: 62175+ A? www.buttercupfestival.com. (43)
19:50:59.259489 IP 192.168.1.101.65396 > 192.168.1.1.domain: 40+ A? pbfcomics.com. (31)
19:50:59.260012 IP 192.168.1.101.56379 > 192.168.1.1.domain: 13264+ A? www.asofterworld.com. (38)
19:50:59.486829 IP 192.168.1.1.domain > 192.168.1.101.61137: 32932 1/0/0 A 64.131.64.226 (57)
19:50:59.493035 IP 192.168.1.1.domain > 192.168.1.101.63998: 3662 1/0/0 A 98.129.229.140 (48)
19:50:59.495230 IP 192.168.1.1.domain > 192.168.1.101.53629: 62175 1/0/0 A 195.26.90.15 (59)
19:50:59.504741 IP 192.168.1.1.domain > 192.168.1.101.65396: 40 1/0/0 A 208.118.225.100 (47)
19:51:00.263595 IP 192.168.1.101.56379 > 192.168.1.1.domain: 13264+ A? www.asofterworld.com. (38)
19:51:00.408192 IP 192.168.1.1.domain > 192.168.1.101.56379: 13264 1/0/0 A 173.231.142.242 (54)
19:51:30.258133 IP 192.168.1.101.62745 > 192.168.1.1.domain: 51499+ A? security-sh3ll.blogspot.com. (45)
19:51:30.362907 IP 192.168.1.1.domain > 192.168.1.101.62745: 51499 4/0/0 CNAME blogspot.l.google.com., A 173.194.41.75, A 173.194.41.74, A 173.194.41.76 (125)
19:51:33.678782 IP 192.168.1.101.53020 > 192.168.1.1.domain: 62825+ A? www.gunnerkrigg.com. (37)
19:51:33.706002 IP 192.168.1.1.domain > 192.168.1.101.53020: 62825 1/0/0 A 69.163.247.78 (53)
19:51:35.912505 IP 192.168.1.101.53605 > 192.168.1.1.domain: 4252+ A? pagead2.googlesyndication.com. (47)
19:51:35.943194 IP 192.168.1.1.domain > 192.168.1.101.53605: 4252 4/0/0 CNAME pagead.l.doubleclick.net., A 173.194.34.153, A 173.194.34.141, A 173.194.34.154 (133)
19:51:36.089428 IP 192.168.1.101.50867 > 192.168.1.1.domain: 56526+ A? www.projectwonderful.com. (42)
19:51:36.128225 IP 192.168.1.1.domain > 192.168.1.101.50867: 56526 2/0/0 CNAME projectwonderful.com., A 74.63.51.103 (72)
19:51:38.152080 IP 192.168.1.101.55977 > 192.168.1.1.domain: 44138+ A? www.topatoco.com. (34)
19:51:38.236035 IP 192.168.1.1.domain > 192.168.1.101.55977: 44138 1/0/0 A 204.15.126.11 (50)
19:51:38.405904 IP 192.168.1.101.64259 > 192.168.1.1.domain: 12766+ A? www-google-analytics.l.google.com. (51)
19:51:38.408547 IP 192.168.1.101.64712 > 192.168.1.1.domain: 11516+ A? twitter.com. (29)
19:51:38.433046 IP 192.168.1.1.domain > 192.168.1.101.64259: 12766 11/0/0 A 173.194.41.136, A 173.194.41.128, A 173.194.41.137, A 173.194.41.135, A 173.194.41.132, A 173.194.41.130, A 173.194.41.142, A 173.194.41.133, A 173.194.41.131, A 173.194.41.134, A 173.194.41.129 (227)
19:51:38.467192 IP 192.168.1.1.domain > 192.168.1.101.64712: 11516 3/0/0 A 199.59.150.7, A 199.59.148.10, A 199.59.149.230 (77)
19:51:39.155744 IP 192.168.1.101.63519 > 192.168.1.1.domain: 3583+ A? www.rsspect.com. (33)
19:51:39.156094 IP 192.168.1.101.55381 > 192.168.1.1.domain: 37971+ A? gunnerkrigg.proboards.com. (43)
19:51:39.202973 IP 192.168.1.1.domain > 192.168.1.101.63519: 3583 1/0/0 A 67.205.63.196 (49)
19:51:39.328598 IP 192.168.1.1.domain > 192.168.1.101.55381: 37971 4/0/0 A 173.192.57.229, A 173.192.57.226, A 173.192.57.228, A 173.192.57.227 (107)

