7:50:47.750980 IP 192.168.1.101.51593 > 192.168.1.1.53: 41801+ A? bbc.co.uk. (27)
17:50:47.780575 IP 192.168.1.1.53 > 192.168.1.101.51593: 41801 1/0/0 A 212.58.241.131 (43)
17:50:47.781293 IP 192.168.1.101.59006 > 192.168.1.1.53: 12733+ AAAA? bbc.co.uk. (27)
17:50:47.808620 IP 192.168.1.1.53 > 192.168.1.101.59006: 12733 0/1/0 (77)
17:50:47.809082 IP 192.168.1.101.55665 > 192.168.1.1.53: 8224+ MX? bbc.co.uk. (27)
17:50:47.836486 IP 192.168.1.1.53 > 192.168.1.101.55665: 8224 2/0/5 MX cluster1a.eu.messagelabs.com. 20, MX cluster1.eu.messagelabs.com. 10 (176)